{
  "$schema": "https://github.com/jakyeamos/tmcp/schemas/tmcp-behavioral-atoms-runtime-h3-decision-v0.7.schema.json",
  "schema": "tmcp-behavioral-atoms-runtime-h3-decision-v0.7",
  "version": "0.7.0",
  "created_at": "2026-08-04",
  "iteration": "runtime-h3-boundary-decision-v0.7",
  "status": "decision_only_private_additive",
  "base": {
    "repository": "jakyeamos/tmcp",
    "head_commit": "4098ba504e63dd8d53f2a1f39827df1461fc425f",
    "declared_h2_base_commit": "3c9b2fe8cc0fe72ed947c447e4ea549094d810c3",
    "source_branch": "main",
    "worktree_state": "dirty_existing_changes_preserved",
    "public_runtime_version": "0.5.7",
    "immutable_baselines": {
      "h1_semantic_preflight": {
        "path": "docs/experiments/behavioral-atoms-semantic-preflight-v0.3.json",
        "sha256": "5bc28d734e9b5903d55b166cb4a1e124c9f740e2a2ac9da8e306d88bfd65857e"
      },
      "h1_fixture_schema": {
        "path": "schemas/tmcp-behavioral-atoms-held-out-fixtures-v0.3.schema.json",
        "sha256": "6b8df833b14b44416ce151674e4bac334e798b2e0ffa2645627606c8796a30f9"
      },
      "h1_fixtures": {
        "path": "tests/fixtures/behavioral-atoms-held-out-v0.3.json",
        "sha256": "172c761fcc5fb8f4814a2e9783b5322ad724b81ebec3ac0c74a1c03e9f9c652f"
      },
      "h2_decision": {
        "path": "docs/experiments/behavioral-atoms-runtime-h2-redaction-ship-gate-v0.6.json",
        "sha256": "8b521e07628628ba84df1816fc5315fdf8cb31b080d23acd40dd8b95d73a988c"
      }
    }
  },
  "decision": {
    "hypothesis_id": "H3.secret_boundary_and_evidence_ladder",
    "selection_basis": "domain_logic",
    "status": "eligible_advisory",
    "source_atoms": [
      {
        "id": "domain.security_privacy.secret_boundary@0.4.0",
        "version": "0.4.0",
        "family": "security_privacy",
        "supersedes": ["domain.security_privacy.secret_boundary@0.3.0"],
        "source_path": "skills/tmcp-security-privacy-audit/SKILL.md",
        "source_sha256": "18c7b963bb400250a3461f306616a53c603e299dafb29afc06c0e411f88e88d7",
        "baseline_distinction": "Adds owned authorization and secret/auth/private-data boundary mapping; H2 redaction transforms or summarizes output and does not establish authority to read.",
        "dependencies": [
          "process.read.required-sources@0.4.0",
          "domain.security_privacy.redaction@0.4.0"
        ],
        "required_inputs": ["authorized_scope", "boundary_evidence"],
        "required_reads": [
          "skills/tmcp-security-privacy-audit/SKILL.md",
          "security docs, privacy docs, environment docs, and relevant code boundaries"
        ],
        "evidence_obligations": [
          "Map the authorized boundary and evidence gaps.",
          "Separate observed findings from inferred risk."
        ],
        "verification_obligations": [
          "Check scope ownership before sensitive evidence is used.",
          "Check the remediation plan against the recorded boundary."
        ],
        "stop_conditions": [
          "Authorized scope is absent or contradictory.",
          "A security finding depends only on generic process language."
        ]
      },
      {
        "id": "domain.release_readiness.evidence_ladder@0.4.0",
        "version": "0.4.0",
        "family": "release_readiness",
        "supersedes": ["domain.release_readiness.evidence_ladder@0.3.0"],
        "source_path": "skills/tmcp-release-readiness/SKILL.md",
        "source_sha256": "54d435ed0f551048cccd47c3093aa0734aff0fda8a15627ff3fb1d8bc8ca11ff",
        "baseline_distinction": "Adds complete, fresh inventory and disposition of release evidence; H2 ship_gate makes a ship/no-ship readiness decision and does not by itself prove ladder completeness.",
        "dependencies": [
          "process.read.required-sources@0.4.0",
          "domain.release_readiness.ship_gate@0.4.0"
        ],
        "required_inputs": ["quality_ladder", "verification_freshness"],
        "required_reads": [
          "skills/tmcp-release-readiness/SKILL.md",
          "CI config, tests, build scripts, package metadata, and release checklist"
        ],
        "evidence_obligations": [
          "Inventory passed, failed, blocked, not-run, and unknown gates.",
          "Record the evidence needed for each remediation slice."
        ],
        "verification_obligations": [
          "Confirm the quality ladder is complete for the declared release scope.",
          "Confirm each remediation slice has an acceptance check."
        ],
        "stop_conditions": [
          "Freshness or scope of the quality ladder is unknown.",
          "A required gate has no disposition."
        ]
      }
    ],
    "valid_arms": [
      {
        "id": "arm.valid.h3.release_receives_secret_boundary",
        "source": "domain.security_privacy.secret_boundary@0.4.0",
        "target_domain": "release_readiness",
        "target_obligation": "release.artifact_access_scope_evidence_chain",
        "unique_delta": true,
        "non_duplicate_of": [
          "arm.valid.release_receives_security_redaction",
          "domain.security_privacy.redaction@0.4.0"
        ],
        "status": "eligible_advisory",
        "provider_outcome": "not_run",
        "cross_skill_composition": "closed_gate"
      },
      {
        "id": "arm.valid.h3.security_receives_evidence_ladder",
        "source": "domain.release_readiness.evidence_ladder@0.4.0",
        "target_domain": "security_privacy",
        "target_obligation": "security.release_evidence_ladder_completeness",
        "unique_delta": true,
        "non_duplicate_of": [
          "arm.valid.security_privacy_receives_release_gating",
          "domain.release_readiness.ship_gate@0.4.0"
        ],
        "status": "eligible_advisory",
        "provider_outcome": "not_run",
        "cross_skill_composition": "closed_gate"
      }
    ],
    "invalid_arms": [
      {
        "id": "arm.invalid.h3.redaction_alias",
        "reason_code": "duplicate_h2_delta",
        "status": "rejected_before_cell"
      },
      {
        "id": "arm.invalid.h3.ship_gate_alias",
        "reason_code": "duplicate_h2_delta",
        "status": "rejected_before_cell"
      },
      {
        "id": "arm.invalid.h3.generic_process_shell",
        "reason_code": "generic_process_duplicate",
        "status": "rejected_before_cell"
      },
      {
        "id": "arm.invalid.h3.no_target_obligation",
        "reason_code": "missing_target_obligation",
        "status": "rejected_before_cell"
      }
    ],
    "provider_outcome": "not_run",
    "cross_skill_composition": "closed_gate",
    "runtime_implementation": "not_started"
  },
  "delta": {
    "source": "The v0.3 source-backed security_privacy.secret_boundary and release_readiness.evidence_ladder semantics, versioned as private v0.4.0 identities, with the v0.6 H2 redaction/ship_gate boundary retained as the prerequisite baseline.",
    "target": "A future opt-in private typed registry/compiler/static-advisory evaluator slice only; no current runtime file, public schema, route, admission path, default, provider, or telemetry surface is changed by this decision.",
    "domains": ["security_privacy", "release_readiness"],
    "new_obligations": [
      "Authorize and map the secret/auth/private-data boundary before reading sensitive evidence.",
      "Separate observed security findings from inferred risk at the owned boundary.",
      "Inventory every release gate as passed, failed, blocked, not-run, or unknown.",
      "Attach freshness and an acceptance check to each release remediation slice.",
      "For the combined arm, preserve both domain attributions while requiring both obligation sets."
    ],
    "preserved_obligations": [
      "H2 redaction keeps output values redacted and records a redaction summary.",
      "H2 ship_gate records current ship blockers and a ship/no-ship readiness disposition.",
      "H1 typed applicability and no-bundle legacy behavior remain unchanged.",
      "Generic process read, capture, verify, stop, and budget gates remain shared prerequisites.",
      "Public packet, receipt, tool, schema, version, default, admission, and routing contracts remain unchanged."
    ],
    "non_duplicate_proof": [
      "secret_boundary controls authorized access and ownership before use; redaction controls safe output after use.",
      "evidence_ladder controls completeness, freshness, and gate disposition; ship_gate controls a release decision from current evidence.",
      "The H3 arms require named target obligations and reject H2 aliases and generic process-only variants before any cell."
    ],
    "combined_interaction": "The new positive combined fixture joins the two distinct obligation sets for one redacted private release artifact. It is a static preregistered interaction input; it does not open cross-skill composition, provider execution, admission, routing, or default activation."
  },
  "private_surfaces": {
    "decision_files_added": [
      "docs/experiments/behavioral-atoms-runtime-h3-secret-boundary-evidence-ladder-v0.7.json",
      "schemas/tmcp-behavioral-atoms-runtime-h3-decision-v0.7.schema.json",
      "schemas/tmcp-behavioral-atoms-runtime-h3-fixtures-v0.7.schema.json",
      "tests/fixtures/behavioral-atoms-runtime-h3-v0.7.json",
      "tests/test_tmcp_behavioral_atoms_runtime_h3_v0_7.py"
    ],
    "future_runtime_owners": [
      {
        "surface": "tmcp_runtime/domain/behavioral_atom_types.py",
        "role": "Private typed H3 atom records and constants only after fresh implementation authorization."
      },
      {
        "surface": "tmcp_runtime/domain/behavioral_atom_registry.py",
        "role": "Private H3 registration and dependency validation only; H3 remains unregistered now."
      },
      {
        "surface": "tmcp_runtime/domain/behavioral_atom_compiler.py",
        "role": "Fail-closed H3 applicability, dependency, conflict, phase, stop, and budget resolution."
      },
      {